18:25:18.856008 shiva.home.1145 > www.bigpond.com.http: P 1551615204:1551615707(503) ack 4018211282 win 5840 (DF)
18:25:18.858041 stargate.home > shiva.home: icmp: www.bigpond.com unreachable - need to frag (mtu 500) [tos 0xc0] 
18:25:18.917149 shiva.home.1042 > sy-dns03.tmns.net.au.domain:  13055+ PTR? 36.5.134.139.in-addr.arpa. (43) (DF)
18:25:19.188500 sy-dns03.tmns.net.au.domain > shiva.home.1042:  13055 2/2/2 (210)
18:25:19.189344 shiva.home.1042 > sy-dns03.tmns.net.au.domain:  13056+ PTR? 51.5.134.139.in-addr.arpa. (43) (DF)
18:25:19.458352 sy-dns03.tmns.net.au.domain > shiva.home.1042:  13056 1/2/2 (175)
18:25:20.586033 shiva.home.ipp > 192.168.1.255.ipp:  udp 99 (DF)
18:25:23.059880 shiva.home.1042 > sy-dns03.tmns.net.au.domain:  58403+ A? mail.bigpond.com. (34) (DF)
18:25:23.327112 sy-dns03.tmns.net.au.domain > shiva.home.1042:  58403 2/2/2 A 144.135.24.9, (166)
18:25:23.327304 shiva.home.1146 > 144.135.24.9.smtp: S 1643612471:1643612471(0) win 5840 <mss 1460,sackOK,timestamp 2206930 0,nop,wscale 0>
18:25:23.327922 shiva.home.1042 > sy-dns03.tmns.net.au.domain:  13057+ PTR? 9.24.135.144.in-addr.arpa. (43) (DF)
18:25:23.596895 144.135.24.9.smtp > shiva.home.1146: S 955555599:955555599(0) ack 1643612472 win 17520 <mss 1460,nop,wscale 0,nop,nop,timestamp 0 0,nop,nop,sackOK> (DF)
18:25:23.596964 shiva.home.1146 > 144.135.24.9.smtp: . ack 1 win 5840 <nop,nop,timestamp 2206957 0>
18:25:23.616904 sy-dns03.tmns.net.au.domain > shiva.home.1042:  13057 NXDomain* 0/1/0 (124)
18:25:23.836798 144.135.24.9.smtp > shiva.home.1146: P 1:58(57) ack 1 win 17520 <nop,nop,timestamp 8972769 2206957> (DF)
18:25:23.836873 shiva.home.1146 > 144.135.24.9.smtp: . ack 58 win 5840 <nop,nop,timestamp 2206981 8972769>
18:25:23.939044 shiva.home.1146 > 144.135.24.9.smtp: P 1:18(17) ack 58 win 5840 <nop,nop,timestamp 2206991 8972769>
18:25:24.146689 144.135.24.9.smtp > shiva.home.1146: P 58:75(17) ack 18 win 17503 <nop,nop,timestamp 8972773 2206991> (DF)
18:25:24.146765 shiva.home.1146 > 144.135.24.9.smtp: . ack 75 win 5840 <nop,nop,timestamp 2207012 8972773>
18:25:24.154110 shiva.home.1146 > 144.135.24.9.smtp: P 18:57(39) ack 75 win 5840 <nop,nop,timestamp 2207012 8972773>
18:25:24.366587 144.135.24.9.smtp > shiva.home.1146: P 75:83(8) ack 57 win 17464 <nop,nop,timestamp 8972775 2207012> (DF)
18:25:24.370136 shiva.home.1146 > 144.135.24.9.smtp: P 57:94(37) ack 83 win 5840 <nop,nop,timestamp 2207034 8972775>
18:25:24.746441 144.135.24.9.smtp > shiva.home.1146: . ack 94 win 17427 <nop,nop,timestamp 8972779 2207034> (DF)
18:25:26.166025 144.135.24.9.smtp > shiva.home.1146: P 83:91(8) ack 94 win 17427 <nop,nop,timestamp 8972792 2207034> (DF)
18:25:26.169570 shiva.home.1146 > 144.135.24.9.smtp: P 94:100(6) ack 91 win 5840 <nop,nop,timestamp 2207214 8972792>
18:25:26.505956 144.135.24.9.smtp > shiva.home.1146: P 91:137(46) ack 100 win 17421 <nop,nop,timestamp 8972796 2207214> (DF)
18:25:26.509001 shiva.home.1146 > 144.135.24.9.smtp: . 100:600(500) ack 137 win 5840 <nop,nop,timestamp 2207248 8972796>
18:25:26.509122 shiva.home.1146 > 144.135.24.9.smtp: P 600:838(238) ack 137 win 5840 <nop,nop,timestamp 2207248 8972796>
18:25:27.045715 144.135.24.9.smtp > shiva.home.1146: . ack 100 win 17421 <nop,nop,timestamp 8972801 2207214,nop,nop,sack sack 1 {600:838} > (DF)
18:25:27.615972 shiva.home.1146 > 144.135.24.9.smtp: . 100:600(500) ack 137 win 5840 <nop,nop,timestamp 2207359 8972801>
18:25:29.835972 shiva.home.1146 > 144.135.24.9.smtp: . 100:600(500) ack 137 win 5840 <nop,nop,timestamp 2207581 8972801>
18:25:34.275973 shiva.home.1146 > 144.135.24.9.smtp: . 100:600(500) ack 137 win 5840 <nop,nop,timestamp 2208025 8972801>
18:25:43.156001 shiva.home.1146 > 144.135.24.9.smtp: . 100:600(500) ack 137 win 5840 <nop,nop,timestamp 2208913 8972801> (DF)
18:25:43.158076 stargate.home > shiva.home: icmp: 144.135.24.9 unreachable - need to frag (mtu 500) [tos 0xc0] 
18:25:48.148955 arp who-has shiva.home tell stargate.home
18:25:48.149003 arp reply shiva.home is-at 0:20:18:54:67:a4
18:25:51.586029 shiva.home.ipp > 192.168.1.255.ipp:  udp 99 (DF)
18:26:00.915978 shiva.home.1146 > 144.135.24.9.smtp: . 100:600(500) ack 137 win 5840 <nop,nop,timestamp 2210689 8972801>
18:26:22.586030 shiva.home.ipp > 192.168.1.255.ipp:  udp 99 (DF)
18:26:36.435982 shiva.home.1146 > 144.135.24.9.smtp: . 100:600(500) ack 137 win 5840 <nop,nop,timestamp 2214241 8972801>
18:26:41.435957 arp who-has stargate.home tell shiva.home
18:26:41.436432 arp reply stargate.home is-at 0:aa:0:37:18:7f
18:26:53.586027 shiva.home.ipp > 192.168.1.255.ipp:  udp 99 (DF)
18:26:54.855981 shiva.home.1145 > www.bigpond.com.http: P 0:503(503) ack 1 win 5840
18:27:00.162840 shiva.home.1146 > 144.135.24.9.smtp: FP 838:841(3) ack 137 win 5840 <nop,nop,timestamp 2216613 8972801>
18:27:00.346434 144.135.24.9.smtp > shiva.home.1146: . ack 100 win 17421 <nop,nop,timestamp 8973735 2207214,nop,nop,sack sack 1 {600:841} > (DF)
18:27:05.344710 arp who-has shiva.home tell stargate.home
18:27:05.344757 arp reply shiva.home is-at 0:20:18:54:67:a4

